{
  "contract_version": "v1",
  "summary": "A job posting implying a concrete task: apply before the deadline.",
  "key_takeaway": "Apply for the role before the window closes.",
  "topics": [
    "careers",
    "deadlines"
  ],
  "suggested_group": "Job search",
  "save_intent": "time_sensitive",
  "recommended_action": "action",
  "evidence": [
    {
      "quote": "apply before the deadline",
      "start_offset": 38,
      "end_offset": 63
    }
  ]
}
