{
  "contract_version": "v1",
  "summary": "A revisit suggestion landing on a real leap day must be accepted.",
  "key_takeaway": "2024-02-29 exists; both validators must agree.",
  "topics": ["validation", "dates"],
  "suggested_group": "Testing",
  "save_intent": "time_sensitive",
  "recommended_action": "revisit",
  "revisit": {
    "reason": "Calendar-validity boundary: a real leap day.",
    "suggested_date": "2024-02-29"
  },
  "evidence": []
}
